{
  "schema": "rolekit/executor-report@1",
  "task_id": "RK-ADAPTER-CURSOR",
  "status": "completed",
  "summary": "mock completed",
  "changed_files": [
    "src/adapter-cursor.txt"
  ],
  "decisions": [],
  "assumptions": [],
  "evidence": [
    "events.jsonl"
  ],
  "risks": [],
  "unresolved": [],
  "recommended_next_action": "verify and integrate"
}
