{
  "schema": "rolekit/executor-report@1",
  "task_id": "RK-20260728-DOG-S2",
  "status": "completed",
  "summary": "{\n  \"schema\": \"rolekit/executor-report@1\",\n  \"status\": \"completed\",\n  \"summary\": \"Created src/dogfood-2.txt with the requested exact content.\",\n  \"changed_files\": [\n    \"src/dogfood-2.txt\"\n  ],\n  \"decisions\": [\n    \"Wrote exactly 12 bytes with no trailing newline.\"\n  ],\n  \"assumptions\": [],\n  \"evidence\": [\n    \"Acceptance command exited 0.\",\n    \"Byte comparison reported exact=true and bytes=12.\"\n  ],\n  \"risks\": [],\n  \"unresolved\": [],\n  \"recommended_next_action\": \"Runner Verifier should evaluat",
  "changed_files": [
    "src/dogfood-2.txt"
  ],
  "decisions": [],
  "assumptions": [],
  "evidence": [
    "events.jsonl"
  ],
  "risks": [],
  "unresolved": [],
  "recommended_next_action": "verify and integrate"
}
