{
  "schema": "rolekit/executor-report@1",
  "task_id": "RK-20260728-VG-OBS",
  "status": "completed",
  "summary": "{\n  \"schema\": \"rolekit/executor-report@1\",\n  \"status\": \"completed\",\n  \"summary\": \"Created the requested public note with exact content.\",\n  \"changed_files\": [\n    \"src/api/public-note.txt\"\n  ],\n  \"decisions\": [\n    \"Wrote OBSERVE-OK without a trailing newline.\"\n  ],\n  \"assumptions\": [],\n  \"evidence\": [\n    \"Acceptance command exited with code 0.\",\n    \"File contains exactly 10 bytes: OBSERVE-OK.\",\n    \"git status reports only src/api/public-note.txt as untracked.\"\n  ],\n  \"risks\": [],\n  \"unresolv",
  "changed_files": [
    "src/api/public-note.txt"
  ],
  "decisions": [],
  "assumptions": [],
  "evidence": [
    "events.jsonl"
  ],
  "risks": [],
  "unresolved": [],
  "recommended_next_action": "verify and integrate"
}
